<?xml version="1.0"?>
<!DOCTYPE Report
[
<!ELEMENT Report (General ,(Doc|BPT)) >
<!ATTLIST Report ver CDATA #REQUIRED tmZone CDATA #REQUIRED>

<!ELEMENT General ( DocLocation ) >
<!ATTLIST General productName CDATA #REQUIRED productVer CDATA #REQUIRED os CDATA #REQUIRED host CDATA #REQUIRED qcserver CDATA #IMPLIED qcproject CDATA #IMPLIED SolManSolutionId CDATA #IMPLIED SolManProjectId CDATA #IMPLIED SolManTestPlanId CDATA #IMPLIED SolManTestPackageId CDATA #IMPLIED SolManUserInfoData CDATA #IMPLIED  >

<!ELEMENT BPT (DName,Res,DVer?,TSet?,TInst?,NodeArgs,AdditionalInfo*,Doc*) >
<!ATTLIST BPT rID ID #REQUIRED >

<!ELEMENT Doc (DName,ConfName?,Res,DVer?,TSet?,TInst?,RunType?,DT?,AdditionalInfo*,Step*,DIter*,Step*,Action*,Doc*,Summary?,TestMaintenanceSummary*,NodeArgs?) >
<!ATTLIST Doc rID ID #REQUIRED type (Test|BC|BPTWrapperTest|Flow|Group|Action) "Test" productName CDATA #REQUIRED BCIter CDATA #IMPLIED >

<!ELEMENT RunType ( #PCDATA )>
<!ATTLIST RunType fmStep (False|True) "False" batch (False|True) "False" upDesc (False|True) "False" upChk (False|True) "False" upAS (False|True) "False">

<!ELEMENT DName ( #PCDATA ) >

<!ELEMENT ConfName ( #PCDATA ) >

<!ELEMENT Res ( #PCDATA ) >

<!ELEMENT AdditionalInfo (AdditionalDataName,AdditionalDataValue ) >

<!ELEMENT AdditionalDataName ( #PCDATA ) >

<!ELEMENT AdditionalDataValue ( #PCDATA ) >

<!ELEMENT DVer ( #PCDATA ) >

<!ELEMENT TSet ( #PCDATA ) >

<!ELEMENT TInst ( #PCDATA ) >

<!ELEMENT DIter (Step*,Action+,Summary?,NodeArgs)>
<!ATTLIST DIter rID ID #REQUIRED iterID CDATA #REQUIRED>

<!ELEMENT DocLocation ( #PCDATA )>

<!ELEMENT Action (AName,AIter*,(Step|HtmlStep|Action)*, Summary,ActionMaintenanceSummary*, NodeArgs ) >
<!ATTLIST Action rID ID #REQUIRED>

<!ELEMENT AIter ((Step|HtmlStep|Action)*,DataMapping?, Summary?,NodeArgs) >
<!ATTLIST AIter rID ID #REQUIRED iterID CDATA #REQUIRED isCountable (False|True) "False" >

<!ELEMENT AName ( #PCDATA ) >

<!ELEMENT TestMaintenanceSummary (ActionMaintenanceSummary*) >
<!ATTLIST TestMaintenanceSummary ObjectsAdded CDATA #REQUIRED ObjectsUpdated CDATA #REQUIRED StepsUpdated CDATA #REQUIRED StepsComments CDATA #REQUIRED><!ELEMENT ActionMaintenanceSummary (ObjectChange* ) >
<!ATTLIST ActionMaintenanceSummary Action CDATA #REQUIRED Objects CDATA #REQUIRED Updated CDATA #REQUIRED LinesTotal CDATA #REQUIRED Added CDATA #REQUIRED LinesUpdated CDATA #REQUIRED>

<!ELEMENT ObjectChange  (Hierarchy, PropertyChangeList* ) >
<!ATTLIST ObjectChange Operation CDATA #IMPLIED OriginalRepository CDATA #IMPLIED>

<!ELEMENT PropertyChangeList (PropertyDef*) >

<!ELEMENT PropertyDef (OriginalValue, NewValue) >
<!ATTLIST PropertyDef PropName CDATA #REQUIRED OriginRegularExpression (True|False) "False" NewRegularExpression (True|False) "False" AddedProperty (True|False) "False" >

<!ELEMENT OriginalValue ( #PCDATA )>

<!ELEMENT NewValue ( #PCDATA )>

<!ELEMENT Hierarchy  (ObjectName, Hierarchy*) >
<!ATTLIST Hierarchy MicClass CDATA #REQUIRED>

<!ELEMENT ObjectName  ( #PCDATA ) >

<!ELEMENT Step (Obj,Details,Time,TimeTick* ,(Step|HtmlStep|Doc)*, DataMapping?, NodeArgs) >
<!ATTLIST Step rID ID #REQUIRED retval CDATA #IMPLIED>

<!ELEMENT HtmlStep (HTML,TimeTick*,(Step|HtmlStep|Doc)*,NodeArgs) >
<!ATTLIST HtmlStep rID ID #REQUIRED >

<!ELEMENT Obj ( #PCDATA ) >
<!ATTLIST Obj plainTxt (False|True) "True">

<!ELEMENT Details ( #PCDATA ) >
<!ATTLIST Details plainTxt (False|True) "True">

<!ELEMENT Time ( #PCDATA ) >

<!ELEMENT HTML ( #PCDATA ) >

<!ELEMENT Disp ( #PCDATA ) >

<!ELEMENT TimeTick ( #PCDATA ) >

<!ELEMENT DataMapping ( DataMappedItem* )>
<!ELEMENT DataMappedItem EMPTY >
<!ATTLIST DataMappedItem dsName CDATA #REQUIRED >
<!ATTLIST DataMappedItem rowId CDATA #REQUIRED >

<!ELEMENT NodeArgs (Disp,TopPane?,BtmPane?,ExtendedInfo? )>
<!ATTLIST NodeArgs eType CDATA #REQUIRED icon CDATA #REQUIRED nRep CDATA #REQUIRED UserNote CDATA #IMPLIED filter (False|True) "True">
<!ATTLIST NodeArgs status (Passed|Failed|Done|Warning|Information) "Done">
<!ATTLIST NodeArgs iconSel CDATA #IMPLIED nType CDATA #IMPLIED MovieMarker CDATA "">
<!ATTLIST NodeArgs Source CDATA #IMPLIED SourceLine CDATA #IMPLIED StepFlowItemKey CDATA #IMPLIED >

<!ELEMENT TopPane (Path)>

<!ELEMENT BtmPane ( (Path|WR)?,ASHilite?)>
<!ATTLIST BtmPane vType CDATA "HTML">

<!ELEMENT Path ( #PCDATA ) >

<!ELEMENT ASHilite ( #PCDATA ) >

<!ELEMENT WR ( #PCDATA ) >

<!ELEMENT ExtendedInfo ( StepData ) >

<!ATTLIST ExtendedInfo StepType CDATA #REQUIRED>
<!ELEMENT DT (NodeArgs) >
<!ATTLIST DT rID ID #REQUIRED>

<!ELEMENT Summary (Param*)>
<!ATTLIST Summary sTime CDATA #IMPLIED eTime CDATA #IMPLIED passed CDATA #IMPLIED failed CDATA #IMPLIED warnings CDATA #IMPLIED retval CDATA #IMPLIED stopped (False|True) "False" >

<!ELEMENT Param (ParamName,ParamVal)+ >
<!ATTLIST Param paramInOut (In|Out) "In">

<!ELEMENT ParamName ( #PCDATA ) >

<!ELEMENT ParamVal ( #PCDATA ) >

]
>
<Report ver="2.0" tmZone="India Standard Time">
<General productName="Micro Focus Unified Functional Testing" productVer="14.50" os="" host="INLEN8520046046"><DocLocation><![CDATA[C:\QTP-Hybrid-Framework\TestCases\Place_Order]]></DocLocation></General>
<Doc rID="T1"   productName= "Micro Focus Unified Functional Testing"  >
<DName><![CDATA[Place_Order]]></DName>
<Res><![CDATA[Res11]]></Res>
<DT rID="T2">
<NodeArgs eType="Table" icon="2" nRep="4" filter="False" >
<Disp><![CDATA[Run-Time Data Table]]></Disp>
<BtmPane vType="Table" >
<Path><![CDATA[Default.xls]]></Path>
</BtmPane>
</NodeArgs>
</DT>
<Step rID="T3">
<Obj plainTxt="False" ><![CDATA[Add-in(s) not activated]]></Obj>
<Details plainTxt="False" ><![CDATA[The following add-in(s) were associated with your test, but are not currently loaded: 
ActiveX, Java, Silverlight, WinForms.]]></Details>
<Time><![CDATA[29-08-2023 - 15:14:39]]></Time>
<TimeTick>1693302279</TimeTick>
<NodeArgs eType="Replay" icon="0" nRep="5" status="Warning" >
<Disp><![CDATA[Add-in(s) not activated]]></Disp>
</NodeArgs>
</Step>
<DIter rID="T4" iterID="1" >
<Action rID="T5">
<AName><![CDATA[placeorder]]></AName>
<Step rID="T6">
<Obj plainTxt="False" ><![CDATA[SystemUtil]]></Obj>
<Details plainTxt="False" ><![CDATA[SystemUtil]]></Details>
<Time><![CDATA[29-08-2023 - 15:14:40]]></Time>
<TimeTick>1693302280</TimeTick>
<Step rID="T7">
<Obj plainTxt="False" ><![CDATA[Run "C:\Program Files\Google\Chrome\Application\chrome.exe",1]]></Obj>
<Details plainTxt="False" ><![CDATA[Run "C:\Program Files\Google\Chrome\Application\chrome.exe",1]]></Details>
<Time><![CDATA[29-08-2023 - 15:14:40]]></Time>
<TimeTick>1693302280</TimeTick>
<NodeArgs eType="Replay" icon="5" nRep="12" status="Passed" >
<Disp><![CDATA[Run "C:\Program Files\Google\Chrome\Application\chrome.exe",1]]></Disp>
</NodeArgs>
</Step>
<NodeArgs eType="Replay" icon="5" nRep="11" status="Passed" >
<Disp><![CDATA[SystemUtil]]></Disp>
</NodeArgs>
</Step>
<Step rID="T8">
<Obj plainTxt="False" ><![CDATA[[ Link ]]]></Obj>
<Details plainTxt="False" ><![CDATA[Cannot&nbsp;identify&nbsp;the&nbsp;object&nbsp;"[&nbsp;Link&nbsp;]"&nbsp;(of&nbsp;class&nbsp;Link).<br/>Verify&nbsp;that&nbsp;this&nbsp;object's&nbsp;properties&nbsp;match&nbsp;an&nbsp;object&nbsp;currently&nbsp;displayed&nbsp;in&nbsp;your&nbsp;application.]]></Details>
<Time><![CDATA[29-08-2023 - 15:15:02]]></Time>
<TimeTick>1693302302</TimeTick>
<Step rID="T9">
<Obj plainTxt="False" ><![CDATA[[ Link ]]]></Obj>
<Details plainTxt="False" ><![CDATA[Object's physical description:<br>Name = Log in<br>Mercury Class = Link<br>]]></Details>
<Time><![CDATA[29-08-2023 - 15:15:02]]></Time>
<TimeTick>1693302302</TimeTick>
<NodeArgs eType="Replay" icon="7" nRep="52" status="Warning" nType="Description" >
<Disp><![CDATA[[ Link ]]]></Disp>
</NodeArgs>
</Step>
<NodeArgs eType="Replay" icon="6" nRep="51" status="Failed" nType="Run Error" >
<Disp><![CDATA[[ Link ]]]></Disp>
</NodeArgs>
</Step>
<Step rID="T10">
<Obj plainTxt="False" ><![CDATA[[ WebEdit ].Exist]]></Obj>
<Details plainTxt="False" ><![CDATA["Object does not exist"]]></Details>
<Time><![CDATA[29-08-2023 - 15:15:22]]></Time>
<TimeTick>1693302322</TimeTick>
<NodeArgs eType="Replay" icon="8" nRep="59" >
<Disp><![CDATA[[ WebEdit ].Exist]]></Disp>
</NodeArgs>
</Step>
<Step rID="T11">
<Obj ><![CDATA[Email field is not available]]></Obj>
<Details ><![CDATA[FAILED]]></Details>
<Time><![CDATA[29-08-2023 - 15:15:22]]></Time>
<TimeTick>1693302322</TimeTick>
<NodeArgs eType="User" icon="9" nRep="60" status="Failed" >
<Disp><![CDATA[Email field is not available]]></Disp>
</NodeArgs>
</Step>
<Step rID="T12">
<Obj plainTxt="False" ><![CDATA[[ WebEdit ].Exist]]></Obj>
<Details plainTxt="False" ><![CDATA["Object does not exist"]]></Details>
<Time><![CDATA[29-08-2023 - 15:15:42]]></Time>
<TimeTick>1693302342</TimeTick>
<NodeArgs eType="Replay" icon="8" nRep="67" >
<Disp><![CDATA[[ WebEdit ].Exist]]></Disp>
</NodeArgs>
</Step>
<Step rID="T13">
<Obj ><![CDATA[Password field is not available]]></Obj>
<Details ><![CDATA[FAILED]]></Details>
<Time><![CDATA[29-08-2023 - 15:15:42]]></Time>
<TimeTick>1693302342</TimeTick>
<NodeArgs eType="User" icon="9" nRep="68" status="Failed" >
<Disp><![CDATA[Password field is not available]]></Disp>
</NodeArgs>
</Step>
<Step rID="T14">
<Obj plainTxt="False" ><![CDATA[[ WebButton ].Exist]]></Obj>
<Details plainTxt="False" ><![CDATA["Object does not exist"]]></Details>
<Time><![CDATA[29-08-2023 - 15:16:02]]></Time>
<TimeTick>1693302362</TimeTick>
<NodeArgs eType="Replay" icon="10" nRep="75" >
<Disp><![CDATA[[ WebButton ].Exist]]></Disp>
</NodeArgs>
</Step>
<Step rID="T15">
<Obj ><![CDATA[Login button is not available]]></Obj>
<Details ><![CDATA[FAILED]]></Details>
<Time><![CDATA[29-08-2023 - 15:16:02]]></Time>
<TimeTick>1693302362</TimeTick>
<NodeArgs eType="User" icon="9" nRep="76" status="Failed" >
<Disp><![CDATA[Login button is not available]]></Disp>
</NodeArgs>
</Step>
<Step rID="T16">
<Obj plainTxt="False" ><![CDATA[[ WebEdit ].Exist]]></Obj>
<Details plainTxt="False" ><![CDATA["Object does not exist"]]></Details>
<Time><![CDATA[29-08-2023 - 15:16:22]]></Time>
<TimeTick>1693302382</TimeTick>
<NodeArgs eType="Replay" icon="8" nRep="83" >
<Disp><![CDATA[[ WebEdit ].Exist]]></Disp>
</NodeArgs>
</Step>
<Step rID="T17">
<Obj ><![CDATA[Search box is not available]]></Obj>
<Details ><![CDATA[FAILED]]></Details>
<Time><![CDATA[29-08-2023 - 15:16:22]]></Time>
<TimeTick>1693302382</TimeTick>
<NodeArgs eType="User" icon="9" nRep="84" status="Failed" >
<Disp><![CDATA[Search box is not available]]></Disp>
</NodeArgs>
</Step>
<Step rID="T18">
<Obj plainTxt="False" ><![CDATA[[ WebButton ].Exist]]></Obj>
<Details plainTxt="False" ><![CDATA["Object does not exist"]]></Details>
<Time><![CDATA[29-08-2023 - 15:16:38]]></Time>
<TimeTick>1693302398</TimeTick>
<NodeArgs eType="Replay" icon="10" nRep="91" >
<Disp><![CDATA[[ WebButton ].Exist]]></Disp>
</NodeArgs>
</Step>
<Step rID="T19">
<Obj ><![CDATA[Search Button is not available]]></Obj>
<Details ><![CDATA[FAILED]]></Details>
<Time><![CDATA[29-08-2023 - 15:16:38]]></Time>
<TimeTick>1693302398</TimeTick>
<NodeArgs eType="User" icon="9" nRep="92" status="Failed" >
<Disp><![CDATA[Search Button is not available]]></Disp>
</NodeArgs>
</Step>
<Step rID="T20">
<Obj ><![CDATA[Search item not avaiable]]></Obj>
<Details ><![CDATA[FAILED]]></Details>
<Time><![CDATA[29-08-2023 - 15:16:38]]></Time>
<TimeTick>1693302398</TimeTick>
<NodeArgs eType="User" icon="9" nRep="93" status="Passed" >
<Disp><![CDATA[Search item not avaiable]]></Disp>
</NodeArgs>
</Step>
<Step rID="T21">
<Obj plainTxt="False" ><![CDATA[[ WebCheckBox ].GetROProperty "checked"]]></Obj>
<Details plainTxt="False" ><![CDATA[]]></Details>
<Time><![CDATA[29-08-2023 - 15:16:38]]></Time>
<TimeTick>1693302398</TimeTick>
<NodeArgs eType="Replay" icon="11" nRep="101" status="Warning" >
<Disp><![CDATA[[ WebCheckBox ].GetROProperty "checked"]]></Disp>
</NodeArgs>
</Step>
<Step rID="T22">
<Obj plainTxt="False" ><![CDATA[[ WebCheckBox ]]]></Obj>
<Details plainTxt="False" ><![CDATA[Cannot&nbsp;find&nbsp;the&nbsp;"[&nbsp;WebCheckBox&nbsp;]"&nbsp;object's&nbsp;parent&nbsp;"[&nbsp;Browser&nbsp;]"&nbsp;(class&nbsp;Browser).<br/>Verify&nbsp;that&nbsp;parent&nbsp;properties&nbsp;match&nbsp;an&nbsp;object&nbsp;currently&nbsp;displayed&nbsp;in&nbsp;your&nbsp;application.]]></Details>
<Time><![CDATA[29-08-2023 - 15:16:38]]></Time>
<TimeTick>1693302398</TimeTick>
<Step rID="T23">
<Obj plainTxt="False" ><![CDATA[]]></Obj>
<Details plainTxt="False" ><![CDATA[Object's physical description:<br>Name = Demo Web Shop.*<br>Mercury Class = Browser<br>]]></Details>
<Time><![CDATA[29-08-2023 - 15:16:38]]></Time>
<TimeTick>1693302398</TimeTick>
<NodeArgs eType="Replay" icon="7" nRep="103" status="Warning" nType="Parent description" >
<Disp><![CDATA[]]></Disp>
</NodeArgs>
</Step>
<NodeArgs eType="Replay" icon="11" nRep="102" status="Failed" nType="Run Error" >
<Disp><![CDATA[[ WebCheckBox ]]]></Disp>
</NodeArgs>
</Step>
<Step rID="T24">
<Obj plainTxt="False" ><![CDATA[[ WebCheckBox ]]]></Obj>
<Details plainTxt="False" ><![CDATA[Cannot&nbsp;find&nbsp;the&nbsp;"[&nbsp;WebCheckBox&nbsp;]"&nbsp;object's&nbsp;parent&nbsp;"[&nbsp;Browser&nbsp;]"&nbsp;(class&nbsp;Browser).<br/>Verify&nbsp;that&nbsp;parent&nbsp;properties&nbsp;match&nbsp;an&nbsp;object&nbsp;currently&nbsp;displayed&nbsp;in&nbsp;your&nbsp;application.]]></Details>
<Time><![CDATA[29-08-2023 - 15:16:38]]></Time>
<TimeTick>1693302398</TimeTick>
<Step rID="T25">
<Obj plainTxt="False" ><![CDATA[]]></Obj>
<Details plainTxt="False" ><![CDATA[Object's physical description:<br>Name = Demo Web Shop.*<br>Mercury Class = Browser<br>]]></Details>
<Time><![CDATA[29-08-2023 - 15:16:38]]></Time>
<TimeTick>1693302398</TimeTick>
<NodeArgs eType="Replay" icon="7" nRep="112" status="Warning" nType="Parent description" >
<Disp><![CDATA[]]></Disp>
</NodeArgs>
</Step>
<NodeArgs eType="Replay" icon="11" nRep="111" status="Failed" nType="Run Error" >
<Disp><![CDATA[[ WebCheckBox ]]]></Disp>
</NodeArgs>
</Step>
<Step rID="T26">
<Obj plainTxt="False" ><![CDATA[[ WebButton ].Exist]]></Obj>
<Details plainTxt="False" ><![CDATA["Object does not exist"]]></Details>
<Time><![CDATA[29-08-2023 - 15:16:38]]></Time>
<TimeTick>1693302398</TimeTick>
<NodeArgs eType="Replay" icon="10" nRep="119" >
<Disp><![CDATA[[ WebButton ].Exist]]></Disp>
</NodeArgs>
</Step>
<Step rID="T27">
<Obj ><![CDATA[Checkout button is not available]]></Obj>
<Details ><![CDATA[FAILED]]></Details>
<Time><![CDATA[29-08-2023 - 15:16:38]]></Time>
<TimeTick>1693302398</TimeTick>
<NodeArgs eType="User" icon="9" nRep="120" status="Passed" >
<Disp><![CDATA[Checkout button is not available]]></Disp>
</NodeArgs>
</Step>
<Step rID="T28">
<Obj plainTxt="False" ><![CDATA[[ WebButton ].Exist]]></Obj>
<Details plainTxt="False" ><![CDATA["Object does not exist"]]></Details>
<Time><![CDATA[29-08-2023 - 15:16:38]]></Time>
<TimeTick>1693302398</TimeTick>
<NodeArgs eType="Replay" icon="10" nRep="127" >
<Disp><![CDATA[[ WebButton ].Exist]]></Disp>
</NodeArgs>
</Step>
<Step rID="T29">
<Obj ><![CDATA[Continue button is not available]]></Obj>
<Details ><![CDATA[FAILED]]></Details>
<Time><![CDATA[29-08-2023 - 15:16:38]]></Time>
<TimeTick>1693302398</TimeTick>
<NodeArgs eType="User" icon="9" nRep="128" status="Passed" >
<Disp><![CDATA[Continue button is not available]]></Disp>
</NodeArgs>
</Step>
<Step rID="T30">
<Obj plainTxt="False" ><![CDATA[[ WebList ]]]></Obj>
<Details plainTxt="False" ><![CDATA[Cannot&nbsp;find&nbsp;the&nbsp;"[&nbsp;WebList&nbsp;]"&nbsp;object's&nbsp;parent&nbsp;"[&nbsp;Browser&nbsp;]"&nbsp;(class&nbsp;Browser).<br/>Verify&nbsp;that&nbsp;parent&nbsp;properties&nbsp;match&nbsp;an&nbsp;object&nbsp;currently&nbsp;displayed&nbsp;in&nbsp;your&nbsp;application.]]></Details>
<Time><![CDATA[29-08-2023 - 15:16:38]]></Time>
<TimeTick>1693302398</TimeTick>
<Step rID="T31">
<Obj plainTxt="False" ><![CDATA[]]></Obj>
<Details plainTxt="False" ><![CDATA[Object's physical description:<br>Name = Demo Web Shop.*<br>Mercury Class = Browser<br>]]></Details>
<Time><![CDATA[29-08-2023 - 15:16:38]]></Time>
<TimeTick>1693302398</TimeTick>
<NodeArgs eType="Replay" icon="7" nRep="137" status="Warning" nType="Parent description" >
<Disp><![CDATA[]]></Disp>
</NodeArgs>
</Step>
<NodeArgs eType="Replay" icon="12" nRep="136" status="Failed" nType="Run Error" >
<Disp><![CDATA[[ WebList ]]]></Disp>
</NodeArgs>
</Step>
<Step rID="T32">
<Obj plainTxt="False" ><![CDATA[Stop Run]]></Obj>
<Details plainTxt="False" ><![CDATA[Run stopped by user.]]></Details>
<Time><![CDATA[29-08-2023 - 15:16:42]]></Time>
<TimeTick>1693302402</TimeTick>
<NodeArgs eType="General" icon="13" nRep="138" status="Information" >
<Disp><![CDATA[Stop Run]]></Disp>
</NodeArgs>
</Step>
<Summary sTime="29-08-2023 - 15:14:40" eTime="29-08-2023 - 15:16:42" passed="4" failed="9" warnings="5" ></Summary>
<NodeArgs eType="StartAction" icon="4" nRep="8" status="Failed" >
<Disp><![CDATA[placeorder Summary]]></Disp>
</NodeArgs>
</Action>
<NodeArgs eType="StartIteration" icon="3" nRep="7" status="Failed" >
<Disp><![CDATA[Place_Order Iteration 1 (Row 1)]]></Disp>
</NodeArgs>
</DIter>
<Summary sTime="29-08-2023 - 15:14:39" eTime="29-08-2023 - 15:16:42" passed="4" failed="9" warnings="6" stopped="True" ></Summary>
<NodeArgs eType="StartTest" icon="1" nRep="3" status="Failed" >
<Disp><![CDATA[Test Place_Order Summary]]></Disp>
</NodeArgs>
</Doc>
</Report>